{
  "report_version": "0.1.0",
  "policy_version": "content-scan-policy@0.1.0",
  "bundle_id": "bundle-0a1b2c3d4e5f-v0_1_0",
  "windows": [
    {
      "window_id": "w-0001",
      "chunk_id": "ck-0001-opening",
      "result": "checked",
      "shingle_hit_rate": 0.0,
      "longest_continuous_match": 0
    },
    {
      "window_id": "w-0002",
      "chunk_id": "ck-0002-meet",
      "result": "inconclusive",
      "note": "budget paused"
    }
  ],
  "coverage_summary": {
    "total_windows": 2,
    "checked_windows": 1,
    "risk_windows": 0,
    "inconclusive_windows": 1,
    "failed_windows": 0
  }
}